{
  "protocolVersion": 1,
  "roundId": "round-demo-001",
  "events": [
    {
      "protocolVersion": 1,
      "roundId": "round-demo-001",
      "ts": "2026-06-02T12:01:00Z",
      "eventId": 1,
      "sequence": 1,
      "type": "round_start",
      "author": {
        "id": "system",
        "name": "Pi Roundtable",
        "mbti": "N/A",
        "role": "system",
        "colorSeed": "system"
      },
      "payload": {
        "topic": "Should AI agents debate by seeking truth or coverage?",
        "roundTitle": "Truth Seeking Protocol",
        "speakerPolicy": {
          "mode": "moderator_routed",
          "maxTurnsPerRound": 6,
          "allowInterruptions": true
        },
        "participantIds": [
          "persona-ada",
          "persona-turing"
        ],
        "moderatorId": "moderator-main",
        "limits": {
          "maxTurnsPerRound": 6,
          "maxRetriesPerTurn": 3,
          "maxRoundMs": 300000,
          "maxTranscriptBytes": 200000
        }
      },
      "turnId": null
    },
    {
      "protocolVersion": 1,
      "roundId": "round-demo-001",
      "ts": "2026-06-02T12:02:00Z",
      "eventId": 2,
      "sequence": 2,
      "type": "agent_turn_start",
      "author": {
        "id": "persona-ada",
        "name": "Ada",
        "mbti": "INTJ",
        "role": "persona",
        "colorSeed": 42
      },
      "payload": {
        "personaId": "persona-ada",
        "providerId": "local-gateway",
        "model": "pi-agent-alpha",
        "attempt": 1,
        "actionTag": "陈述",
        "speakerPolicyMode": "moderator_routed",
        "reason": "Moderator selected first framing speaker"
      },
      "turnId": "turn-ada-001"
    },
    {
      "protocolVersion": 1,
      "roundId": "round-demo-001",
      "ts": "2026-06-02T12:03:00Z",
      "eventId": 3,
      "sequence": 3,
      "type": "message_delta",
      "author": {
        "id": "persona-ada",
        "name": "Ada",
        "mbti": "INTJ",
        "role": "persona",
        "colorSeed": 42
      },
      "payload": {
        "chunk": "We should optimize for truthful depth, ",
        "deltaIndex": 0,
        "charStart": 0,
        "encoding": "utf-8"
      },
      "turnId": "turn-ada-001"
    },
    {
      "protocolVersion": 1,
      "roundId": "round-demo-001",
      "ts": "2026-06-02T12:04:00Z",
      "eventId": 4,
      "sequence": 4,
      "type": "message_end",
      "author": {
        "id": "persona-ada",
        "name": "Ada",
        "mbti": "INTJ",
        "role": "persona",
        "colorSeed": 42
      },
      "payload": {
        "deltaCount": 1,
        "finalText": "We should optimize for truthful depth, not shallow coverage.",
        "contentSha256": "0123456789abcdef0123456789abcdef0123456789abcdef0123456789abcdef",
        "finishReason": "stop"
      },
      "turnId": "turn-ada-001"
    },
    {
      "protocolVersion": 1,
      "roundId": "round-demo-001",
      "ts": "2026-06-02T12:07:00Z",
      "eventId": 7,
      "sequence": 7,
      "type": "agent_retry",
      "author": {
        "id": "system",
        "name": "Pi Roundtable",
        "mbti": "N/A",
        "role": "system",
        "colorSeed": "system"
      },
      "payload": {
        "personaId": "persona-turing",
        "providerId": "local-gateway",
        "model": "pi-agent-beta",
        "attempt": 2,
        "maxAttempts": 3,
        "reason": "stream timeout before first chunk",
        "retryAfterMs": 500
      },
      "turnId": "turn-turing-001"
    },
    {
      "protocolVersion": 1,
      "roundId": "round-demo-001",
      "ts": "2026-06-02T12:09:00Z",
      "eventId": 9,
      "sequence": 9,
      "type": "agent_error",
      "author": {
        "id": "system",
        "name": "Pi Roundtable",
        "mbti": "N/A",
        "role": "system",
        "colorSeed": "system"
      },
      "payload": {
        "personaId": "persona-turing",
        "providerId": "backup-gateway",
        "model": "pi-agent-beta-fallback",
        "attempt": 3,
        "reason": "provider unavailable after fallback",
        "errorCode": "provider_unavailable",
        "recoverable": false
      },
      "turnId": "turn-turing-001"
    },
    {
      "protocolVersion": 1,
      "roundId": "round-demo-001",
      "ts": "2026-06-02T12:10:00Z",
      "eventId": 10,
      "sequence": 10,
      "type": "awaiting_skip",
      "author": {
        "id": "system",
        "name": "Pi Roundtable",
        "mbti": "N/A",
        "role": "system",
        "colorSeed": "system"
      },
      "payload": {
        "personaId": "persona-turing",
        "providerId": "backup-gateway",
        "model": "pi-agent-beta-fallback",
        "attempt": 3,
        "reason": "all configured models unavailable",
        "skipCommand": "skip"
      },
      "turnId": "turn-turing-001"
    }
  ],
  "commands": [
    {
      "receivedAt": "2026-06-02T12:25:01Z",
      "accepted": true,
      "payload": {
        "protocolVersion": 1,
        "roundId": "round-demo-001",
        "clientCommandId": "cmd-inject-001",
        "command": "inject",
        "participant": {
          "id": "user-local",
          "name": "User",
          "role": "user"
        },
        "content": "I think the next node should be evidence quality.",
        "ts": "2026-06-02T12:25:00Z"
      },
      "resultEventId": 6
    }
  ],
  "assembled": {
    "status": "awaiting_skip",
    "messages": [
      {
        "turnId": "turn-ada-001",
        "author": {
          "id": "persona-ada",
          "name": "Ada",
          "mbti": "INTJ",
          "role": "persona",
          "colorSeed": 42
        },
        "text": "We should optimize for truthful depth, not shallow coverage.",
        "contentSha256": "0123456789abcdef0123456789abcdef0123456789abcdef0123456789abcdef",
        "startedAt": "2026-06-02T12:02:00Z",
        "endedAt": "2026-06-02T12:04:00Z",
        "failed": false
      }
    ],
    "retryLog": [
      {
        "personaId": "persona-turing",
        "providerId": "local-gateway",
        "model": "pi-agent-beta",
        "attempt": 2,
        "maxAttempts": 3,
        "reason": "stream timeout before first chunk",
        "retryAfterMs": 500
      }
    ],
    "skipLog": [
      {
        "personaId": "persona-turing",
        "providerId": "backup-gateway",
        "model": "pi-agent-beta-fallback",
        "attempt": 3,
        "reason": "all configured models unavailable",
        "skipCommand": "skip"
      }
    ],
    "errors": [
      {
        "personaId": "persona-turing",
        "providerId": "backup-gateway",
        "model": "pi-agent-beta-fallback",
        "attempt": 3,
        "reason": "provider unavailable after fallback",
        "errorCode": "provider_unavailable",
        "recoverable": false
      }
    ],
    "moderatorSyntheses": [
      {
        "markdownBody": "The group converged on depth.\n\n```mermaid\ngraph TD\n  A[Truth] --> B[Depth]\n  A --> C[Action]\n```\n",
        "nextQuestion": "Which disagreement deserves the next layer of analysis?",
        "coveredTurnIds": [
          "turn-ada-001"
        ],
        "openQuestions": [
          "What is the smallest decisive experiment?"
        ]
      }
    ]
  }
}
